{
  "meta": {
    "id": "mortuary-makeup-artist",
    "title": "殡仪馆化妆师",
    "subtitle": "给逝者画上最后一张脸的人——在生死边界守护尊严的守艺人",
    "sourceType": "documentary",
    "narrativeTemplate": "daily_poetry",
    "createdAt": "2026-06-15T19:00:00+08:00",
    "version": 1
  },
  "events": [
    {
      "id": "evt_01_dawn_arrival",
      "title": "凌晨四点半的到岗仪式",
      "description": "更换工作服、消毒双手，查看当日遗体整容清单。清晨的殡仪馆安静得只有空调嗡鸣声。",
      "ageRange": { "start": 28 },
      "category": "career",
      "emotion": "neutral",
      "emotionIntensity": 0.2,
      "narrativeText": "凌晨四点半，更衣室的灯管发出轻微的嗡嗡声。\n\n你换上白色工作服，仔细消毒双手。指甲缝里不能留任何痕迹——这是对逝者最基本的尊重。\n\n今天的清单上有三具遗体。第一具是车祸，面部多处骨折；第二具是自然离世的老人；第三具……是一个年轻的男孩。\n\n你深吸一口气，推开工作间的门。",
      "bgmTag": "morning_calm",
      "visualTone": "cool"
    },
    {
      "id": "evt_02_first_restoration",
      "title": "石膏重塑的面孔",
      "description": "为车祸逝者修复面容，用石膏重塑轮廓。每一笔都是在还原一个人生前的模样。",
      "ageRange": { "start": 28 },
      "category": "career",
      "isKeyNode": true,
      "emotion": "sadness",
      "emotionIntensity": 0.6,
      "narrativeText": "车祸带走了他原本的面容。\n\n你用石膏一点一点重塑颧骨的轮廓，手指感受着骨骼断裂后的错位。这不是雕塑创作——你是在帮一个人找回他自己。\n\n家属带来的照片里，他笑得很灿烂。你把那张照片放在工作台角落，时不时看一眼。\n\n「要让他看起来像睡着了。」家属说这话时声音在抖。\n\n你点点头，继续手中的工作。手很稳，心也很稳。这是专业素养，也是你对逝者的承诺。",
      "bgmTag": "somber_piano",
      "visualTone": "dark",
      "interactionChoice": {
        "prompt": "修复过程中，你发现照片里的他和现在的样子差距很大。你会怎么做？",
        "options": [
          {
            "label": "尽可能还原照片中的笑容",
            "response": "你花了额外的时间调整嘴角的弧度。虽然无法完全复原，但至少让家属看到了一丝熟悉的温暖。"
          },
          {
            "label": "保持安详自然的表情",
            "response": "你没有刻意追求与照片一致，而是让他呈现出一种平静的安详。有时候，'像睡着了'比'像在笑'更能安慰活着的人。"
          }
        ]
      }
    },
    {
      "id": "evt_03_tea_break",
      "title": "七点半的热茶",
      "description": "短暂休息，喝杯热茶暖暖手。手温对化妆效果至关重要。",
      "ageRange": { "start": 28 },
      "category": "daily_life",
      "emotion": "neutral",
      "emotionIntensity": 0.1,
      "narrativeText": "七点半，你放下工具，给自己倒了杯热茶。\n\n不是因为渴，而是因为手需要温度。冰冷的指尖碰触逝者的皮肤时，会让化妆品附着不均匀。\n\n茶杯的热气模糊了你的视线。窗外天已经亮了，但工作间里没有窗户。\n\n你搓了搓手，感受热量慢慢渗进指节。这杯茶是你和'正常世界'之间短暂的连接。",
      "bgmTag": "gentle_acoustic",
      "visualTone": "warm"
    },
    {
      "id": "evt_04_lipstick_moment",
      "title": "那支一模一样的口红",
      "description": "为22岁女孩化妆时，发现她照片里的口红色号和自己包里的一模一样。生与死的边界在那一刻变得模糊。",
      "ageRange": { "start": 28 },
      "category": "crisis",
      "isKeyNode": true,
      "emotion": "mixed",
      "emotionIntensity": 0.8,
      "narrativeText": "她才22岁。\n\n母亲带来了一张自拍照片，说「就化这个妆」。照片里的女孩对着镜头嘟嘴，口红是那种很温柔的豆沙色。\n\n你打开自己的化妆包，愣住了。\n\n你的包里有一支一模一样的口红。\n\n同一个色号，同一个品牌。也许你们曾在同一家专柜试过色，也许你们都喜欢那个博主的推荐。\n\n你拿起那支口红，轻轻涂在她的唇上。手没有抖，但心里有什么东西碎了一下。\n\n她不是'逝者'。她是一个和你一样爱美的女孩，只是生命停在了22岁。",
      "bgmTag": "cello_solo",
      "visualTone": "warm",
      "interactionChoice": {
        "prompt": "这一刻，你想到了什么？",
        "options": [
          {
            "label": "想到自己22岁时在做什么",
            "response": "22岁的你在大学宿舍里试新买的口红，对着镜子傻笑。那时候觉得死亡是很远很远的事。现在你知道，它从来都不远。"
          },
          {
            "label": "专注完成妆容，不让情绪影响工作",
            "response": "你把那支口红放回包里，深呼吸一次。她的手艺不会因为情绪而打折——这是你能给她的最后一份体面。"
          }
        ]
      }
    },
    {
      "id": "evt_05_nameless_body",
      "title": "没有人送他最后一程",
      "description": "遇到一具无名遗体，没有家属认领。依然认真为他刮胡子、整理头发。",
      "ageRange": { "start": 28 },
      "category": "spiritual",
      "isKeyNode": true,
      "emotion": "sadness",
      "emotionIntensity": 0.7,
      "narrativeText": "他没有名字。\n\n登记表上写着「无名氏，男，约50岁」。没有家属来认领，没有遗照可以参考，没有人告诉你他生前喜欢什么样的发型。\n\n但你还是认真地为他刮了胡子，整理了头发。\n\n「没有人送他最后一程，至少让他干干净净地走。」\n\n你对同事说了这句话。同事没回应，只是点了点头。\n\n在这个房间里，尊严不需要观众。即使没有人会看见你的工作，你也把它做到最好。\n\n因为他是人。这就够了。",
      "bgmTag": "silence_heavy",
      "visualTone": "dark",
      "interactionChoice": {
        "prompt": "面对无名遗体，你的内心感受是什么？",
        "options": [
          {
            "label": "感到一种超越职业的责任",
            "response": "这份工作教会你最深刻的一课：尊严不是别人给的，是人本身就该有的。哪怕全世界都忘了他，你的手还记得。"
          },
          {
            "label": "想起自己是否也被谁遗忘过",
            "response": "你突然想到，每个人在某些时刻都是'无名氏'。被忽视、被遗忘、不被在意。也许正因为如此，你才格外珍惜每一个被你照顾的人。"
          }
        ]
      }
    },
    {
      "id": "evt_06_grandmother_call",
      "title": "不能滴在别人亲人脸上的眼泪",
      "description": "工作中接到电话得知外婆去世。平静完成手头工作后，才走到休息室痛哭。",
      "ageRange": { "start": 28 },
      "category": "loss",
      "isKeyNode": true,
      "emotion": "sadness",
      "emotionIntensity": 0.9,
      "narrativeText": "手机震动的时候，你正在为一位老人调整眉形。\n\n是妈妈的电话。你犹豫了一下，还是接了。\n\n「外婆走了。」\n\n你的手停在半空中。老人的眉毛还差最后几笔。\n\n你说「我知道了」，然后挂断电话。\n\n继续画完那道眉毛。继续整理衣领。继续检查每一个细节。\n\n直到把这位老人送走，你才走进休息室，关上门，蹲在地上哭了出来。\n\n「我不能把眼泪滴在别人的亲人脸上。」\n\n后来有人问你为什么这么冷静。你没有解释。有些悲伤，只能留给自己的时间。",
      "bgmTag": "melancholic_strings",
      "visualTone": "dark",
      "interactionChoice": {
        "prompt": "如果你是她的朋友，听到这件事会说什么？",
        "options": [
          {
            "label": "「你不需要一直这么坚强」",
            "response": "她笑了笑说：'不是坚强，是习惯了。'但你知道，习惯不等于不痛。有些人的坚强，只是因为没有人允许他们脆弱。"
          },
          {
            "label": "什么都不说，只是陪着她",
            "response": "有时候语言太轻了。你坐在她旁边，递一杯温水。沉默比任何安慰都更有重量。"
          }
        ]
      }
    },
    {
      "id": "evt_07_intern_collapse",
      "title": "哭是正常的，不哭才不正常",
      "description": "新来的实习生第一次面对儿童遗体时崩溃大哭。她没有安慰，只是默默接过工具完成了剩余工作。",
      "ageRange": { "start": 28 },
      "category": "career",
      "emotion": "mixed",
      "emotionIntensity": 0.6,
      "narrativeText": "实习生是个刚毕业的小姑娘。\n\n当她看到那具小小的遗体时，整个人僵住了。然后眼泪像决堤一样涌出来，蹲在地上哭得喘不过气。\n\n你没有安慰她。\n\n不是冷漠，是因为你知道，此刻任何安慰都是多余的。有些冲击，必须自己承受。\n\n你默默接过她手中的工具，完成了剩下的工作。\n\n事后她在休息室找到你，红着眼睛道歉。\n\n你说：「哭是正常的。不哭才不正常。」\n\n这句话是你入行第一年，师傅对你说的。现在你把它传给了下一个人。",
      "bgmTag": "healing_gentle",
      "visualTone": "neutral"
    },
    {
      "id": "evt_08_evening_ritual",
      "title": "下班前的三次深呼吸",
      "description": "在更衣室换上自己的衣服，对着镜子深呼吸三次。这是每天从'死亡空间'回到'生活空间'的仪式。",
      "ageRange": { "start": 28 },
      "category": "daily_life",
      "emotion": "neutral",
      "emotionIntensity": 0.3,
      "narrativeText": "下午四点半，你填完最后一份工作日志。\n\n走进更衣室，脱下白色工作服，叠好放进柜子。换上自己的衣服——一件浅蓝色的衬衫，是你喜欢的颜色。\n\n对着镜子，深呼吸三次。\n\n第一次，呼出工作间里消毒水的味道。\n第二次，呼出今天见过的所有面孔。\n第三次，吸入属于你自己的空气。\n\n镜子里的你，眼神平静。但只有你知道，这份平静下面沉淀了多少重量。\n\n你推开门，走进傍晚的阳光里。街上的行人匆匆走过，没有人知道你刚刚从哪里来。\n\n这样就好。",
      "bgmTag": "ending_peaceful",
      "visualTone": "warm"
    }
  ],
  "emotionalArc": {
    "overallTone": "bittersweet",
    "peakMoments": ["evt_04_lipstick_moment", "evt_06_grandmother_call"],
    "valleyMoments": ["evt_05_nameless_body"]
  },
  "safetyInfo": {
    "complianceLevel": "L2",
    "popularityLevel": "S",
    "commercialValue": "V1",
    "triggerWarnings": ["death", "grief", "bereavement"],
    "requiresSafetyPrompt": true,
    "requiresAgeVerification": false
  }
}
