{
  "meta": {
    "id": "memory-authenticator-first-month",
    "title": "记忆原片鉴定师·在记忆被AI美颜的世界里找回真实",
    "subtitle": "当98%的人选择美化记忆，你是那个拒绝滤镜的守夜人",
    "sourceType": "ugc_submission",
    "narrativeTemplate": "crossroads",
    "createdAt": "2026-06-22T06:00:00+08:00",
    "version": 1
  },
  "events": [
    {
      "id": "day0-launch",
      "title": "Day 0·记忆美颜滤镜全球上线",
      "description": "NeuroGlow公司发布记忆美颜脑机接口滤镜，98%用户在48小时内开通。你的记忆原片鉴定所挂牌，第一位客户上门——一位声称'我好像从来没有跟任何人吵过架'的中年女性。",
      "ageRange": { "start": 28 },
      "category": "career",
      "isKeyNode": true,
      "emotion": "surprise",
      "emotionIntensity": 0.7,
      "narrativeText": "2027年3月15日，NeuroGlow的记忆美颜滤镜全球同步上线。你的手机被推送淹没：'恭喜！您的记忆已自动优化。'你关掉通知，把写着'记忆原片鉴定所'的木牌挂在门口。第一个客户是个中年女人，她说她已经三年没跟女儿说话了，但在记忆里她们'关系很好'。",
      "bgmTag": "lofi_electronic",
      "visualTone": "cool",
      "interactionChoice": {
        "prompt": "面对第一位客户……",
        "options": [
          { "label": "立即开始鉴定，帮她找回原片", "response": "你戴上耳机，调出她的记忆档案。美颜版里母女俩笑容灿烂，但你注意到女儿的眼睛从未真正看向母亲。" },
          { "label": "先询问她为什么想找回真实记忆", "response": "她沉默了很久，说：'因为我发现我不记得自己生气的样子了。一个不会生气的人，还是人吗？'" }
        ]
      }
    },
    {
      "id": "day3-busy",
      "title": "Day 3-5·业务爆发期",
      "description": "每天30+客户排队。典型案例：一位母亲发现滤镜把她对女儿说的狠话美颜成了'妈妈永远支持你的选择'。女儿已经不跟她说话三年，但记忆里她们关系很好。",
      "ageRange": { "start": 28 },
      "category": "career",
      "isKeyNode": false,
      "emotion": "mixed",
      "emotionIntensity": 0.6,
      "narrativeText": "第三天起，门口排起了队。一个男人发现自己求婚被拒的记忆变成了'浪漫的错过'；一个女孩发现被霸凌的记忆变成了'宝贵的成长经历'。最让你心痛的是那位母亲——滤镜把她骂女儿'考不上大学就去打工'变成了温柔的鼓励。女儿已经三年没叫她妈了，但在美颜记忆里，她们每天都在拥抱。",
      "bgmTag": "gentle_acoustic",
      "visualTone": "warm"
    },
    {
      "id": "day7-breakthrough",
      "title": "Day 7-10·技术突破：梦境回溯法",
      "description": "发现大脑杏仁核在REM睡眠期会短暂绕过滤镜存储原始副本。开发出'梦境回溯引导法'，通过特定音频刺激唤醒原始记忆。",
      "ageRange": { "start": 28 },
      "category": "achievement",
      "isKeyNode": true,
      "emotion": "joy",
      "emotionIntensity": 0.8,
      "narrativeText": "第七天凌晨三点，你在实验室里盯着脑波图发呆。突然你发现了——杏仁核，情绪记忆的中枢，在REM睡眠期会短暂绕过滤镜。就像相机快门关闭的瞬间，原始画面偷偷溜了进去。你花了三天开发出'梦境回溯引导法'：让客户进入REM睡眠，用40Hz的伽马波音频刺激杏仁核，唤醒那些被美颜覆盖的原片。第一次成功时，客户醒来哭了。她说她终于记起了自己愤怒的样子。",
      "bgmTag": "ambient_rain",
      "visualTone": "neutral",
      "interactionChoice": {
        "prompt": "梦境回溯法有风险……",
        "options": [
          { "label": "谨慎使用，每次只做一例", "response": "你给自己定了规矩：每天只接一个需要梦境回溯的客户。慢，但安全。" },
          { "label": "扩大规模，帮助更多人", "response": "你把方法写成手册，培训了两个助手。效率提高了，但你开始担心质量控制。" }
        ]
      }
    },
    {
      "id": "day14-lawsuit",
      "title": "Day 14-18·伦理争议与诉讼",
      "description": "NeuroGlow法务部起诉你'非法破解专利技术'。同时反滤镜地下组织'记忆原教旨主义'联系你，要求合作批量恢复社会真相。你拒绝了。",
      "ageRange": { "start": 28 },
      "category": "crisis",
      "isKeyNode": true,
      "emotion": "fear",
      "emotionIntensity": 0.7,
      "narrativeText": "律师函比客户来得更早。NeuroGlow说你'非法破解专利技术'，索赔五百万。同一天，一个戴兜帽的男人在巷子里拦住你，自称'记忆原教旨主义'的成员。他说政府暴力、企业丑闻都被系统美化了，要你帮忙恢复'社会真相'。你拒绝了。他说你会后悔的。那天晚上，你把鉴定所的灯关了，坐在黑暗里听自己的心跳。",
      "bgmTag": "urban_night",
      "visualTone": "dark",
      "interactionChoice": {
        "prompt": "面对压力……",
        "options": [
          { "label": "坚持立场，继续做记忆守夜人", "response": "你把律师函钉在墙上，旁边贴了一张便利贴：'真相不是专利。'" },
          { "label": "暂时低调，减少公开业务", "response": "你关掉了线上预约，只接受熟人介绍的客户。安静，但没有停止。" }
        ]
      }
    },
    {
      "id": "day22-old-zhang",
      "title": "Day 22-25·老张的案子：选择性忽视",
      "description": "前同事刑警老张来访，需要恢复一段被美颜的办案记忆。找回原片后发现冤案真凶另有其人，但也意味着老张必须面对自己当时'选择性忽视'的愧疚。",
      "ageRange": { "start": 28 },
      "category": "relationship",
      "isKeyNode": true,
      "emotion": "sadness",
      "emotionIntensity": 0.9,
      "narrativeText": "老张是你当刑警时的搭档。他坐在你对面，手一直在抖。'那段记忆里有证据，'他说，'但我潜意识把它模糊了。'你帮他进入REM睡眠，用40Hz音频唤醒了原片。他看到了——案发当晚他其实注意到了关键细节，但因为太累、因为想早点结案、因为不想承认自己可能抓错了人，他选择了'没看见'。醒来后他哭了整整一个小时。不是因为AI美颜了他的记忆，而是因为他终于看清了自己。",
      "bgmTag": "melancholy_piano",
      "visualTone": "dark",
      "interactionChoice": {
        "prompt": "老张的原片揭示了人性的弱点……",
        "options": [
          { "label": "完全恢复，让他面对全部真相", "response": "你把所有细节都展示给他。他颤抖着点头：'这才是我该承受的。'" },
          { "label": "保留部分美颜，给他缓冲空间", "response": "你隐去了最刺痛的部分。他松了口气，但你知道，有些真相迟早要面对。" }
        ]
      }
    },
    {
      "id": "day28-choice",
      "title": "Day 28-30·终极抉择：善意谎言vs残酷真相",
      "description": "NeuroGlow提出和解：关闭鉴定所换取不被起诉。同时全球用户出现'美颜依赖症'，抑郁症确诊率上升340%。你面临最终选择。",
      "ageRange": { "start": 28 },
      "category": "crisis",
      "isKeyNode": true,
      "emotion": "mixed",
      "emotionIntensity": 0.9,
      "narrativeText": "第三十天。NeuroGlow的和解协议放在桌上：签字，关店，免于起诉。窗外，一个女孩对着手机笑，但眼睛里没有光——她已经无法接受未经美颜的现实了。抑郁症确诊率上升了340%。你看着协议，想起老张的眼泪，想起那位母亲终于记起自己生气的样子。如果真相让人痛苦，美化后的记忆让人幸福，哪一个更道德？",
      "bgmTag": "silence_then_single_note",
      "visualTone": "neutral",
      "interactionChoice": {
        "prompt": "最终的选择……",
        "options": [
          { "label": "拒绝和解，继续做记忆守夜人", "response": "你把协议推回去。'有些人需要痛，才能确认自己还活着。'门关上了，但灯还亮着。" },
          { "label": "接受和解，但保留地下业务", "response": "你签了字。鉴定所关门了。但深夜，你依然在公寓里帮少数人找回他们的原片。真相转入地下，但没有消失。" },
          { "label": "接受和解，彻底退出", "response": "你签了字，摘下了木牌。也许这个世界真的更喜欢美颜版的自己。你不确定这是对是错。" }
        ]
      }
    }
  ],
  "emotionalArc": {
    "overallTone": "bittersweet",
    "peakMoments": ["day7-breakthrough", "day22-old-zhang"],
    "valleyMoments": ["day14-lawsuit", "day28-choice"]
  },
  "safetyInfo": {
    "complianceLevel": "L1",
    "popularityLevel": "S",
    "commercialValue": "V3",
    "triggerWarnings": ["科技伦理", "记忆真实性", "心理健康"],
    "requiresSafetyPrompt": false,
    "requiresAgeVerification": false
  }
}
